ef6a0e80 605885739 C Ii:5:003:3 0:2 15 = 20010200 01000000 00000000 000000
e80e5d80 605886510 S Ii:5:003:3 -115:2 32 <
e80e5f00 605954684 S Co:5:003:0 s 21 09 0210 0002 0007 7 = 10018063 870000
e80e5f00 605955750 C Co:5:003:0 0 7 >
e80e5d80 606005750 C Ii:5:003:3 0:2 7 = 10018063 000000
e80e5d80 606008528 S Ii:5:003:3 -115:2 32 <
e80e5f00 606011687 S Co:5:003:0 s 21 09 0210 0002 0007 7 = 10018051 101100
e80e5f00 606012745 C Co:5:003:0 0 7 >
e80e5d80 606015737 C Ii:5:003:3 0:2 15 = 20010200 00000000 00000000 000000
e80e5d80 606016622 S Ii:5:003:3 -115:2 32 <
e80e5d80 606029738 C Ii:5:003:3 0:2 7 = 10018051 000000
e80e5d80 606031653 S Ii:5:003:3 -115:2 32 <
e80e5f00 606032690 S Co:5:003:0 s 21 09 0210 0002 0007 7 = 10018051 300300
e80e5f00 606033737 C Co:5:003:0 0 7 >
e80e5d80 606135747 C Ii:5:003:3 0:2 7 = 10018051 000000
e80e5d80 606167606 S Ii:5:003:3 -115:2 32 <
e80e5f00 607679575 S Co:5:003:0 s 21 09 0210 0002 0007 7 = 10018051 101100
e80e5f00 607680793 C Co:5:003:0 0 7 >
e80e5d80 607705801 C Ii:5:003:3 0:2 7 = 10018051 000000
e80e5d80 607707650 S Ii:5:003:3 -115:2 32 <
